{
  "@context": [
    "https://www.w3.org/ns/credentials/v2",
    "https://fair2.ai/context/v1.4.0"
  ],
  "id": "https://fair2.ai/certifiers/registry.json",
  "type": "FAIR2CertifierRegistry",
  "issuer": "did:web:fair2.ai",
  "updated": "2026-04-01T00:00:00Z",
  "certifiers": [
    {
      "id": "did:web:sen.science",
      "name": "SENSCIENCE",
      "identifier": "https://ror.org/02wn5qz54",
      "licenceTier": "commercial",
      "allowedScopes": [
        "metadataConformance",
        "dataIntegrity",
        "licenseVerification",
        "processAttestation",
        "temporalProof"
      ],
      "validFrom": "2026-01-01",
      "validUntil": "2026-12-31",
      "status": "active"
    },
    {
      "id": "did:web:example-institute.org",
      "name": "Example Institute Data Office",
      "licenceTier": "non-commercial",
      "allowedScopes": [
        "metadataConformance",
        "licenseVerification"
      ],
      "validFrom": "2026-03-01",
      "validUntil": "2027-02-28",
      "status": "active"
    }
  ],
  "proof": {
    "type": "DataIntegrityProof",
    "cryptosuite": "eddsa-jcs-2022",
    "created": "2026-04-01T00:00:00Z",
    "verificationMethod": "did:web:fair2.ai#z6MkhaXgBZDvotDkL5257faiztiGiC2QtKLGpbnnEGta2doK",
    "proofPurpose": "assertionMethod",
    "proofValue": "z5fHs8HFLEaGcGtpPmwKXWbpHLnqmfWVVh1KvLqnF2GpVbBKgkDyqJ8rC6YwVt4Z3FhRrUqmnPVKLt3bN9xWcTmQ"
  }
}
